{
  "schemaVersion": 1,
  "title": "西游记人物关系",
  "maxChapter": 1,
  "coreId": "wukong",
  "characters": [
    {
      "id": "wukong",
      "name": "孙悟空",
      "group": "取经团队",
      "placement": {
        "level": 0,
        "order": 0
      },
      "description": "唐僧的大徒弟，曾在菩提祖师门下学艺，保护唐僧西天取经。",
      "chapter": 1,
      "aliases": ["美猴王", "齐天大圣", "孙行者"],
      "attributes": {
        "出身": "花果山水帘洞",
        "师承": "菩提祖师；唐僧",
        "兵器": "如意金箍棒",
        "主要经历": "学艺、闹天宫、护送取经"
      },
      "tags": ["取经团队"],
      "position": {
        "x": 0,
        "y": 0
      }
    },
    {
      "id": "tangseng",
      "name": "唐僧",
      "group": "取经团队",
      "placement": {
        "level": 0,
        "order": -1
      },
      "description": "前往西天求取真经，是孙悟空、猪八戒和沙僧的师父。",
      "chapter": 1,
      "aliases": ["唐三藏", "玄奘"],
      "attributes": {
        "身份": "取经僧人",
        "使命": "前往西天求取真经",
        "相关物品": "锦襕袈裟、九环锡杖"
      },
      "tags": ["取经团队"],
      "position": {
        "x": -210,
        "y": 0
      }
    },
    {
      "id": "bajie",
      "name": "猪八戒",
      "group": "取经团队",
      "placement": {
        "level": 0,
        "order": 1
      },
      "description": "唐僧的二徒弟，与孙悟空、沙僧同行取经。",
      "chapter": 1,
      "aliases": ["猪悟能", "天蓬元帅"],
      "attributes": {
        "前身": "天蓬元帅",
        "兵器": "九齿钉耙",
        "相关地点": "高老庄"
      },
      "tags": ["取经团队"],
      "position": {
        "x": 210,
        "y": 0
      }
    },
    {
      "id": "shaseng",
      "name": "沙僧",
      "group": "取经团队",
      "placement": {
        "level": 0,
        "order": 2
      },
      "description": "在流沙河加入取经队伍，护送唐僧西行。",
      "chapter": 1,
      "aliases": ["沙悟净", "沙和尚"],
      "attributes": {
        "前身": "卷帘大将",
        "相关地点": "流沙河",
        "身份": "取经团队成员"
      },
      "tags": ["取经团队"],
      "position": {
        "x": 420,
        "y": 0
      }
    },
    {
      "id": "bailongma",
      "name": "白龙马",
      "group": "取经团队",
      "placement": {
        "level": 0,
        "order": -2
      },
      "description": "西海龙王之子，化为白马驮负唐僧西行。",
      "chapter": 1,
      "aliases": ["小白龙"],
      "attributes": {
        "出身": "西海龙宫",
        "相关地点": "鹰愁涧",
        "职责": "化作白马驮负唐僧"
      },
      "tags": ["取经团队"],
      "position": {
        "x": -420,
        "y": 0
      }
    },
    {
      "id": "puti",
      "name": "菩提祖师",
      "group": "神佛与仙人",
      "placement": {
        "level": -1,
        "order": -2
      },
      "description": "孙悟空早年的授业师父，传授其变化与腾云之术。",
      "chapter": 1,
      "aliases": ["须菩提祖师"],
      "attributes": {
        "居所": "灵台方寸山、斜月三星洞",
        "身份": "孙悟空的授业师父"
      },
      "tags": ["神佛与仙人"],
      "position": {
        "x": -420,
        "y": -190
      }
    },
    {
      "id": "guanyin",
      "name": "观音菩萨",
      "group": "神佛与仙人",
      "placement": {
        "level": -1,
        "order": -1
      },
      "description": "参与安排取经事业，并多次帮助取经团队解难。",
      "chapter": 1,
      "aliases": ["观世音菩萨"],
      "attributes": {
        "居所": "南海普陀山",
        "职责": "安排取经并救助取经团队"
      },
      "tags": ["神佛与仙人"],
      "position": {
        "x": -210,
        "y": -190
      }
    },
    {
      "id": "rulai",
      "name": "如来佛祖",
      "group": "神佛与仙人",
      "placement": {
        "level": -1,
        "order": 0
      },
      "description": "曾将孙悟空压在五行山下，取经团队最终到达其所在的灵山。",
      "chapter": 1,
      "aliases": ["如来"],
      "attributes": {
        "居所": "灵山",
        "相关事件": "五行山镇压、辨认六耳猕猴"
      },
      "tags": ["神佛与仙人"],
      "position": {
        "x": 0,
        "y": -190
      }
    },
    {
      "id": "yudi",
      "name": "玉皇大帝",
      "group": "天庭与龙宫",
      "placement": {
        "level": -2,
        "order": 0
      },
      "description": "天庭之主，曾招孙悟空入天庭任职，后来派兵征讨。",
      "chapter": 1,
      "aliases": ["玉帝"],
      "attributes": {
        "身份": "天庭之主",
        "相关事件": "招安孙悟空、天庭征讨"
      },
      "tags": ["天庭与龙宫"],
      "position": {
        "x": 0,
        "y": -380
      }
    },
    {
      "id": "laojun",
      "name": "太上老君",
      "group": "天庭与龙宫",
      "placement": {
        "level": -2,
        "order": 1
      },
      "description": "孙悟空曾偷吃其金丹，并被投入八卦炉。青牛和金银二童与其有关。",
      "chapter": 1,
      "aliases": ["老君"],
      "attributes": {
        "居所": "兜率宫",
        "相关物品": "八卦炉、金刚琢"
      },
      "tags": ["天庭与龙宫"],
      "position": {
        "x": 210,
        "y": -380
      }
    },
    {
      "id": "taibai",
      "name": "太白金星",
      "group": "天庭与龙宫",
      "placement": {
        "level": -2,
        "order": -1
      },
      "description": "曾建议招安孙悟空，并向其传达天庭诏命。",
      "chapter": 1,
      "aliases": ["太白金星"],
      "attributes": {
        "身份": "天庭使者",
        "相关事件": "招安孙悟空"
      },
      "tags": ["天庭与龙宫"],
      "position": {
        "x": -210,
        "y": -380
      }
    },
    {
      "id": "erlang",
      "name": "二郎神",
      "group": "天庭与龙宫",
      "placement": {
        "level": -2,
        "order": -2
      },
      "description": "曾与孙悟空斗法，参与将其擒获。",
      "chapter": 1,
      "aliases": ["二郎显圣真君"],
      "attributes": {
        "居所": "灌江口",
        "相关事件": "与孙悟空斗法"
      },
      "tags": ["天庭与龙宫"],
      "position": {
        "x": -420,
        "y": -380
      }
    },
    {
      "id": "donghai",
      "name": "东海龙王",
      "group": "天庭与龙宫",
      "placement": {
        "level": -2,
        "order": -3
      },
      "description": "孙悟空曾到其龙宫取得金箍棒。",
      "chapter": 1,
      "aliases": ["敖广"],
      "attributes": {
        "居所": "东海龙宫",
        "相关物品": "定海神珍铁"
      },
      "tags": ["天庭与龙宫"],
      "position": {
        "x": -630,
        "y": -380
      }
    }
  ],
  "relations": [
    {
      "id": "r01",
      "source": "tangseng",
      "target": "wukong",
      "label": "师徒",
      "type": "mentorship",
      "description": "唐僧收孙悟空为徒，孙悟空保护唐僧取经。",
      "directed": true,
      "fromChapter": 1
    },
    {
      "id": "r02",
      "source": "tangseng",
      "target": "bajie",
      "label": "师徒",
      "type": "mentorship",
      "description": "猪八戒拜唐僧为师，加入取经队伍。",
      "directed": true,
      "fromChapter": 1
    },
    {
      "id": "r03",
      "source": "tangseng",
      "target": "shaseng",
      "label": "师徒",
      "type": "mentorship",
      "description": "沙僧经点化后拜唐僧为师。",
      "directed": true,
      "fromChapter": 1
    },
    {
      "id": "r04",
      "source": "tangseng",
      "target": "bailongma",
      "label": "坐骑",
      "type": "alliance",
      "description": "白龙马化为白马，驮负唐僧西行。",
      "directed": false,
      "fromChapter": 1
    },
    {
      "id": "r05",
      "source": "wukong",
      "target": "bajie",
      "label": "同门",
      "type": "alliance",
      "description": "孙悟空与猪八戒同为唐僧弟子，协力取经。",
      "directed": false,
      "fromChapter": 1
    },
    {
      "id": "r06",
      "source": "wukong",
      "target": "shaseng",
      "label": "同门",
      "type": "alliance",
      "description": "孙悟空与沙僧共同护送唐僧。",
      "directed": false,
      "fromChapter": 1
    },
    {
      "id": "r07",
      "source": "bajie",
      "target": "shaseng",
      "label": "同门",
      "type": "alliance",
      "description": "猪八戒与沙僧是共同取经的师兄弟。",
      "directed": false,
      "fromChapter": 1
    },
    {
      "id": "r08",
      "source": "puti",
      "target": "wukong",
      "label": "授业",
      "type": "mentorship",
      "description": "菩提祖师传授孙悟空法术。",
      "directed": true,
      "fromChapter": 1
    },
    {
      "id": "r09",
      "source": "guanyin",
      "target": "wukong",
      "label": "帮助",
      "type": "alliance",
      "description": "观音多次回应孙悟空的求助，协助取经团队解难。",
      "directed": true,
      "fromChapter": 1
    },
    {
      "id": "r10",
      "source": "guanyin",
      "target": "tangseng",
      "label": "指引",
      "type": "mentorship",
      "description": "观音向唐僧指示西天取经之事。",
      "directed": true,
      "fromChapter": 1
    },
    {
      "id": "r11",
      "source": "rulai",
      "target": "wukong",
      "label": "镇压",
      "type": "conflict",
      "description": "大闹天宫之后，如来将孙悟空压在五行山下。",
      "directed": true,
      "fromChapter": 1
    },
    {
      "id": "r12",
      "source": "yudi",
      "target": "wukong",
      "label": "招安",
      "type": "alliance",
      "description": "玉帝曾授予孙悟空天庭官职。",
      "directed": true,
      "fromChapter": 1
    },
    {
      "id": "r13",
      "source": "yudi",
      "target": "wukong",
      "label": "征讨",
      "type": "conflict",
      "description": "孙悟空反出天庭后，玉帝派兵征讨。与招安发生在不同阶段。",
      "directed": true,
      "fromChapter": 1
    },
    {
      "id": "r14",
      "source": "taibai",
      "target": "wukong",
      "label": "招安使者",
      "type": "alliance",
      "description": "太白金星曾前往花果山招安孙悟空。",
      "directed": false,
      "fromChapter": 1
    },
    {
      "id": "r15",
      "source": "laojun",
      "target": "wukong",
      "label": "八卦炉炼化",
      "type": "conflict",
      "description": "太上老君曾将孙悟空投入八卦炉。",
      "directed": false,
      "fromChapter": 1
    },
    {
      "id": "r16",
      "source": "erlang",
      "target": "wukong",
      "label": "斗法",
      "type": "conflict",
      "description": "二郎神曾与孙悟空展开变化斗法。",
      "directed": false,
      "fromChapter": 1
    },
    {
      "id": "r17",
      "source": "donghai",
      "target": "wukong",
      "label": "取得金箍棒",
      "type": "investigation",
      "description": "孙悟空在东海龙宫取得如意金箍棒。",
      "directed": false,
      "fromChapter": 1
    }
  ]
}
